<?xml version="1.0" encoding="ISO-8859-1"?>
<!DOCTYPE ZDC PUBLIC "ZDC020401.dtd" "ZDC020401.dtd">
<?xml-stylesheet href="ZDC020401.xsl" type="text/xsl"?>

<ZDC>
  <IDENT>
    <DATEINAME>v063003056D___BCM.xml</DATEINAME>
    <DATEIID>56D063v____</DATEIID>
    <VERSION-TYP>020401</VERSION-TYP>
    <VERSION-INHALT>0030</VERSION-INHALT>
    <DATUM>2014-11-21</DATUM>
    <BESCHREIBUNG></BESCHREIBUNG>
    <CNT-CHECKSUMME>6845C04A4116395C4A08A06A9468E3EAA2344739</CNT-CHECKSUMME>
  </IDENT>
  <INFO>
    <ADRESSEN>
      <ADRESSE>
        <FIRMA>IAV GmbH</FIRMA>
        <ABTEILUNG>EEKE/2</ABTEILUNG>
        <FUNKTION>?</FUNKTION>
        <MITARBEITER>Mann, Matthias</MITARBEITER>
        <TELEFON>0172 1902505</TELEFON>
        <MOBILE></MOBILE>
        <FAX></FAX>
        <EMAIL>extern.matthias.mann@volkswagen.de</EMAIL>
      </ADRESSE>
      <ADRESSE>
        <FIRMA>Volkswagen AG</FIRMA>
        <ABTEILUNG>EEKE/2</ABTEILUNG>
        <FUNKTION>Konstrukteur</FUNKTION>
        <MITARBEITER>Oberschmidt, Carsten</MITARBEITER>
        <TELEFON>+49 5361 9 76734</TELEFON>
        <MOBILE></MOBILE>
        <FAX></FAX>
        <EMAIL>carsten.oberschmidt@volkswagen.de</EMAIL>
      </ADRESSE>
      <ADRESSE>
        <FIRMA>Volkswagen AG</FIRMA>
        <ABTEILUNG>PS-Z2/E</ABTEILUNG>
        <FUNKTION>?</FUNKTION>
        <MITARBEITER>Brendeke, Jens</MITARBEITER>
        <TELEFON>+49 5361 9 24253</TELEFON>
        <MOBILE></MOBILE>
        <FAX></FAX>
        <EMAIL></EMAIL>
      </ADRESSE>
      <ADRESSE>
        <FIRMA>IAV GmbH Ingenieurgesellschaft Auto und Verkehr</FIRMA>
        <ABTEILUNG>EEKE/2</ABTEILUNG>
        <FUNKTION>Consulter</FUNKTION>
        <MITARBEITER>Hoffmann, Stefan</MITARBEITER>
        <TELEFON>+49 172 1580844</TELEFON>
        <MOBILE></MOBILE>
        <FAX></FAX>
        <EMAIL>extern.stefan.hoffmann@volkswagen.de</EMAIL>
      </ADRESSE>
      <ADRESSE>
        <FIRMA>Volkswagen AG</FIRMA>
        <ABTEILUNG>EEKE/2</ABTEILUNG>
        <FUNKTION>Konstrukteur</FUNKTION>
        <MITARBEITER>Schröder, Dr., Jens</MITARBEITER>
        <TELEFON>+49 5361 9 72523</TELEFON>
        <MOBILE></MOBILE>
        <FAX></FAX>
        <EMAIL></EMAIL>
      </ADRESSE>
      <ADRESSE>
        <FIRMA>IAV GmbH</FIRMA>
        <ABTEILUNG>EEKE/2</ABTEILUNG>
        <FUNKTION>?</FUNKTION>
        <MITARBEITER>Otte , Felix</MITARBEITER>
        <TELEFON>+49 5371 8053504</TELEFON>
        <MOBILE></MOBILE>
        <FAX></FAX>
        <EMAIL>extern.felix.otte@volkswagen.de</EMAIL>
      </ADRESSE>
      <ADRESSE>
        <FIRMA>IAV GmbH</FIRMA>
        <ABTEILUNG>EEKE/2</ABTEILUNG>
        <FUNKTION>?</FUNKTION>
        <MITARBEITER>Radke, Dennis</MITARBEITER>
        <TELEFON>+49 5371 805 5760</TELEFON>
        <MOBILE></MOBILE>
        <FAX></FAX>
        <EMAIL>extern.dennis.radke@volkswagen.de</EMAIL>
      </ADRESSE>
      <ADRESSE>
        <FIRMA>IAV</FIRMA>
        <ABTEILUNG>VE-D42</ABTEILUNG>
        <FUNKTION>?</FUNKTION>
        <MITARBEITER>Walter, Burghard</MITARBEITER>
        <TELEFON></TELEFON>
        <MOBILE></MOBILE>
        <FAX></FAX>
        <EMAIL>extern.burghard.walter1@volkswagen.de</EMAIL>
      </ADRESSE>
      <ADRESSE>
        <FIRMA>SKODA AUTO a.s.</FIRMA>
        <ABTEILUNG>TMB</ABTEILUNG>
        <FUNKTION>Konstrukteur</FUNKTION>
        <MITARBEITER>Jecny, Tomas</MITARBEITER>
        <TELEFON>+420 326 8 15855</TELEFON>
        <MOBILE></MOBILE>
        <FAX></FAX>
        <EMAIL>tomas.jecny@skoda-auto.cz</EMAIL>
      </ADRESSE>
      <ADRESSE>
        <FIRMA>Volkswagen AG</FIRMA>
        <ABTEILUNG>EESA</ABTEILUNG>
        <FUNKTION>Konstukteur</FUNKTION>
        <MITARBEITER>Muschler, Ralf</MITARBEITER>
        <TELEFON>+49 5361 9 77235</TELEFON>
        <MOBILE></MOBILE>
        <FAX></FAX>
        <EMAIL></EMAIL>
      </ADRESSE>
      <ADRESSE>
        <FIRMA>Benteler</FIRMA>
        <ABTEILUNG>EEKE2</ABTEILUNG>
        <FUNKTION>?</FUNKTION>
        <MITARBEITER>Kinder, Alexander</MITARBEITER>
        <TELEFON>+49 1522 2998985</TELEFON>
        <MOBILE></MOBILE>
        <FAX></FAX>
        <EMAIL>extern.alexander.kinder@volkswagen.de</EMAIL>
      </ADRESSE>
      <ADRESSE>
        <FIRMA>Volkswagen AG</FIRMA>
        <ABTEILUNG>EESA/2</ABTEILUNG>
        <FUNKTION>Konstrukteur</FUNKTION>
        <MITARBEITER>Koch, Gerald</MITARBEITER>
        <TELEFON>+49 5361 9 78960</TELEFON>
        <MOBILE></MOBILE>
        <FAX></FAX>
        <EMAIL>gerald.koch@volkswagen.de</EMAIL>
      </ADRESSE>
      <ADRESSE>
        <FIRMA>in-tech GmbH</FIRMA>
        <ABTEILUNG>EEKE/2</ABTEILUNG>
        <FUNKTION>?</FUNKTION>
        <MITARBEITER>Göricke, Thorsten</MITARBEITER>
        <TELEFON>+49 152 22991897</TELEFON>
        <MOBILE></MOBILE>
        <FAX></FAX>
        <EMAIL>extern.thorsten.goericke@volkswagen.de</EMAIL>
      </ADRESSE>
    </ADRESSEN>
  </INFO>
  <VORSCHRIFT>
    <DIREKT>
      <DIAGN>
        <BUS>CAN</BUS>
        <ADR>09</ADR>
        <KWP>KWP2000</KWP>
        <TP>TP2.0</TP>
      </DIAGN>
      <TABELLEN>
        <REFERENZ>
          <REFFAM>
            <FAMNR>AED</FAMNR>
            <PRNR>7LQ</PRNR>
          </REFFAM>
          <REFFAM>
            <FAMNR>ASE</FAMNR>
            <PRNR>6XC</PRNR>
            <PRNR>6XD</PRNR>
            <PRNR>6XE</PRNR>
            <PRNR>6XF</PRNR>
            <PRNR>6XG</PRNR>
            <PRNR>6XK</PRNR>
            <PRNR>6XL</PRNR>
          </REFFAM>
          <REFFAM>
            <FAMNR>DEI</FAMNR>
            <PRNR>3FA</PRNR>
            <PRNR>3FE</PRNR>
          </REFFAM>
          <REFFAM>
            <FAMNR>FLS</FAMNR>
            <PRNR>8K0</PRNR>
            <PRNR>8K3</PRNR>
            <PRNR>8K8</PRNR>
            <PRNR>9I5</PRNR>
          </REFFAM>
          <REFFAM>
            <FAMNR>HKA</FAMNR>
            <PRNR>9AU</PRNR>
            <PRNR>KH6</PRNR>
          </REFFAM>
          <REFFAM>
            <FAMNR>HSW</FAMNR>
            <PRNR>8ID</PRNR>
            <PRNR>8IH</PRNR>
            <PRNR>8IM</PRNR>
            <PRNR>8IU</PRNR>
          </REFFAM>
          <REFFAM>
            <FAMNR>INL</FAMNR>
            <PRNR>6T0</PRNR>
            <PRNR>6T1</PRNR>
          </REFFAM>
          <REFFAM>
            <FAMNR>KAR</FAMNR>
            <PRNR>K8B</PRNR>
          </REFFAM>
          <REFFAM>
            <FAMNR>MFA</FAMNR>
            <PRNR>9Q1</PRNR>
            <PRNR>9Q4</PRNR>
            <PRNR>9Q5</PRNR>
          </REFFAM>
          <REFFAM>
            <FAMNR>SDH</FAMNR>
            <PRNR>4E2</PRNR>
            <PRNR>4E6</PRNR>
            <PRNR>5I0</PRNR>
          </REFFAM>
          <REFFAM>
            <FAMNR>SIH</FAMNR>
            <PRNR>4A0</PRNR>
            <PRNR>4A3</PRNR>
            <PRNR>4A4</PRNR>
          </REFFAM>
          <REFFAM>
            <FAMNR>SNA</FAMNR>
            <PRNR>7L3</PRNR>
            <PRNR>7L6</PRNR>
          </REFFAM>
          <REFFAM>
            <FAMNR>SWR</FAMNR>
            <PRNR>8X0</PRNR>
            <PRNR>8X1</PRNR>
          </REFFAM>
          <REFFAM>
            <FAMNR>TKV</FAMNR>
            <PRNR>4F2</PRNR>
            <PRNR>4I2</PRNR>
            <PRNR>4I4</PRNR>
            <PRNR>4K3</PRNR>
          </REFFAM>
        </REFERENZ>
        <TABELLE>
          <MODUS>C</MODUS>
          <MODUSTEIL>PKZZ_C1</MODUSTEIL>
          <BESCHREIBUNG></BESCHREIBUNG>
          <ZAHLENBASIS>1</ZAHLENBASIS>
          <KOPF>
            <ZDE>
              <ZDSTELLE>1</ZDSTELLE>
              <ZDBYTE>
                <ZMSB>7</ZMSB>
                <ZLSB>7</ZLSB>
                <ZBEZ>ZV individuell selektive Öffnung (Kessy)</ZBEZ>
              </ZDBYTE>
              <ZDBYTE>
                <ZMSB>6</ZMSB>
                <ZLSB>6</ZLSB>
                <ZBEZ>ZV Funk im Transportmodus aktiv</ZBEZ>
              </ZDBYTE>
              <ZDBYTE>
                <ZMSB>5</ZMSB>
                <ZLSB>5</ZLSB>
                <ZBEZ>ZV ohne SAFE Funktion</ZBEZ>
              </ZDBYTE>
              <ZDBYTE>
                <ZMSB>4</ZMSB>
                <ZLSB>4</ZLSB>
                <ZBEZ>ZV seitenselektive Öffnung</ZBEZ>
              </ZDBYTE>
              <ZDBYTE>
                <ZMSB>3</ZMSB>
                <ZLSB>3</ZLSB>
                <ZBEZ>ZV mit Einzeltürentriegelung</ZBEZ>
              </ZDBYTE>
              <ZDBYTE>
                <ZMSB>2</ZMSB>
                <ZLSB>2</ZLSB>
                <ZBEZ>ZV mit Auto Lock aktiv (automatische Komplettverriegelung bei v&gt;15km/h)</ZBEZ>
              </ZDBYTE>
              <ZDBYTE>
                <ZMSB>1</ZMSB>
                <ZLSB>1</ZLSB>
                <ZBEZ>ZV mit Auto Unlock aktiv (Entriegelung bei Abzug des Zündschlüssels)</ZBEZ>
              </ZDBYTE>
              <ZDBYTE>
                <ZMSB>0</ZMSB>
                <ZLSB>0</ZLSB>
                <ZBEZ>ZV mit Sperrung der Autolock Deaktivierung aktiv</ZBEZ>
              </ZDBYTE>
            </ZDE>
            <ZDE>
              <ZDSTELLE>2</ZDSTELLE>
              <ZDBYTE>
                <ZMSB>7</ZMSB>
                <ZLSB>7</ZLSB>
                <ZBEZ>Verbau zweiteilige Heckklappe (SK461)</ZBEZ>
              </ZDBYTE>
              <ZDBYTE>
                <ZMSB>6</ZMSB>
                <ZLSB>6</ZLSB>
                <ZBEZ>HDF Innentaster direkt einlesen / CAN-Eingang inaktiv</ZBEZ>
              </ZDBYTE>
              <ZDBYTE>
                <ZMSB>5</ZMSB>
                <ZLSB>5</ZLSB>
                <ZBEZ>Valet Parking aktiv</ZBEZ>
              </ZDBYTE>
              <ZDBYTE>
                <ZMSB>4</ZMSB>
                <ZLSB>4</ZLSB>
                <ZBEZ>Verbau Heckschloss mit Vorraste</ZBEZ>
              </ZDBYTE>
              <ZDBYTE>
                <ZMSB>3</ZMSB>
                <ZLSB>3</ZLSB>
                <ZBEZ>Heckschloss kontaktgesteuert</ZBEZ>
              </ZDBYTE>
              <ZDBYTE>
                <ZMSB>2</ZMSB>
                <ZLSB>2</ZLSB>